"date","time","account","text"
"2024-12-10","09:56:02","長岡 健@TakeruNagaoka","経営組織論（第12回）「アンラーニング」#mgtorg2024おはようございます。寒い朝ですが、冬の冷気は気持ちにスイッチを入れてくれます。ぬくぬく過ごす猫たちに「行ってきます！」とつげて、私は市ヶ谷に向かいます。

温かい飲み物を用意して、さあ今日も楽しく学ぼう！pic.x.com/uDrm3jfLIs"
"2024-12-10","10:38:58","まる@oDApfas7DPvsAp3","おはようございます☀️
先週に比べてグッと寒くなった！？❄️
寒さに負けずに今日も頑張る！！教室は暖かい！笑#mgtorg2024"
"2024-12-10","10:42:42","プロガムラー@googlevsapplevs","家族全員風邪なので
家で大人しくzoomで見てます#mgtorg2024"
"2024-12-10","10:43:41","けいたつ I 若者の機会損失をゼロにする@_kk_marumaru","今日は色々ありネカフェからの参加です😇#mgtorg2024"
"2024-12-10","10:43:55","味噌ラーメン@yuta_mgtorg2024","過去最大に眠いけど授業に出たこと…(苦笑)#mgtorg2024#GandN"
"2024-12-10","10:45:37","けいたつ I 若者の機会損失をゼロにする@_kk_marumaru","新しい服を買って友達に褒められたのでハッピーハッピーハーッピーです🐱#mgtorg2024"
"2024-12-10","10:45:45","まる@oDApfas7DPvsAp3","昨日、ずっと目をつけていた焼き鳥屋さんに行きました！！焼き鳥ももちろん美味しかったけど、豚バラの串カツ(？)が大優勝でした！！美味しかった！！あと鶏茶漬けも美味しかった！！#mgtorg2024#GandN"
"2024-12-10","10:46:50","味噌ラーメン@yuta_mgtorg2024","もう今年も終わりですね…
今年どころか大学生活3/4終わるんですね…(震え)#mgtorg2024"
"2024-12-10","10:47:20","ペパーミント@If8Rywjdt","雲丹プリン食べた#mgtorg2024#GandNpic.x.com/tU5u85pxXB"
"2024-12-10","10:49:02","まめきち@mamekiti_hamham","香川県三豊市のもりうどん#mgtorg2024pic.x.com/XxOpS5qJZA"
"2024-12-10","10:49:18","あもーれ@1sfzWkHIGu6XdGs","気を引き締めたり、気分を切り替えたりする場って自分だけだと意外と作れない。どうしても予定調和っぽくなる。そこからズレるためにはやっぱり人に会うってのが大事なんだろうな。#mgtorg2024"
"2024-12-10","10:49:20","しずの@ofRKrrWtqa87140","何もないような…と思ったけど、ゲームとか何やらやりながら、時間かけて作った鶏ハムが美味しかったのは良かったかな？#mgtorg2024#GandN"
"2024-12-10","10:49:40","harunchu@hamunin331","一年間あっという間すぎる#mgtorg2024"
"2024-12-10","10:50:01","noir@hoseinoir","#mgtorg2024意識の長いトンネルを抜けるとそこは駅の救護室であった………………"
"2024-12-10","10:51:01","ボウルサラダボウル@SiTiMiY4_ch","#mgtorg2024エアコン苦手！
最近こたつにハマってますよ〜"
"2024-12-10","10:51:51","けいたつ I 若者の機会損失をゼロにする@_kk_marumaru","炎上系ツイッタラーになっちゃおうかな😈#mgtorg2024"
"2024-12-10","10:52:02","プロガムラー@googlevsapplevs","パジャマで受ける授業
めっちゃ心地いい#mgtorg2024"
"2024-12-10","10:52:19","ボウルサラダボウル@SiTiMiY4_ch","#mgtorg2024「冗談」が見たい人は、ララチューブのマネタクと西田の彼女が寝てみたを見ましょう😊"
"2024-12-10","10:54:05","あもーれ@1sfzWkHIGu6XdGs","コスパを考えるにあたって、そもそも「パフォーマンス」がなんなのかを意識することも大切なのかもしれない。その「パフォーマンス」は本当に意味があるのか？#mgtorg2024"
"2024-12-10","10:54:05","まめきち@mamekiti_hamham","今日はなんかぼーっとしちゃう感じだから、グラレコとかしながら受けてみようかな🏠#mgtorg2024"
"2024-12-10","10:54:11","こんぺい@yu813508346040","昨日横浜中華街で食べたお粥が美味しすぎた！はじめてお店でお粥食べたけど、家で作るのと違う！😋#mgtorg2024#GandNpic.x.com/2gi6Tu2bc8"
"2024-12-10","10:55:34","プロガムラー@googlevsapplevs","先月まで映画館で上映してたけど
今月から早くもアマプラで観れるから
観て欲しい#mgtorg2024pic.x.com/MReaOIXaoi"
"2024-12-10","10:56:56","あもーれ@1sfzWkHIGu6XdGs","スタバの話めっちゃわかる。Tallってそんな厳密に量決まってないんだ…！って思う。むしろ日常のランダマイザとして面白いけどね。#mgtorg2024"
"2024-12-10","10:57:46","プロガムラー@googlevsapplevs","就活エージェントの鬼電半端ない#mgtorg2024"
"2024-12-10","10:59:27","さとう@i029460965472","ナレッジワーカー、再現性のない仕事
今や聞き慣れたけどこの授業履修してなかったら一生出会わなかった概念かも#mgtorg2024"
"2024-12-10","11:00:26","あもーれ@1sfzWkHIGu6XdGs","懐かしいなぁ。傾向と対策。#mgtorg2024"
"2024-12-10","11:01:41","まる@oDApfas7DPvsAp3","焦らず長く頑張る
すぐには成長しない#mgtorg2024"
"2024-12-10","11:01:49","味噌ラーメン@yuta_mgtorg2024","頑張るけど、長く走り続けるためには頑張りすぎない#mgtorg2024"
"2024-12-10","11:02:41","プロガムラー@googlevsapplevs","気づいたら10年経ってたくらいの
ルーティンみたいのにするのがいい#mgtorg2024"
"2024-12-10","11:02:48","味噌ラーメン@yuta_mgtorg2024","一夜漬けみたいに短期的なことは頑張りすぎてもどうにかなるかもしれないけど、 長期的なことは頑張りすぎないことも大事？#mgtorg2024"
"2024-12-10","11:03:06","あもーれ@1sfzWkHIGu6XdGs","大切なのは正しいフォーム。とはいえ、体や心のクセは人それぞれだから、誰かのを真似したり、試行錯誤したりしながら、自分なりのフォーム（マイセオリー）を見つける。それを大学で少しでも掴めたらいいなと思う。#mgtorg2024"
"2024-12-10","11:04:30","上腕三頭筋@jo13tokin","スポーツよりも適応大事なのか！#mgtorg2024"
"2024-12-10","11:04:40","まる@oDApfas7DPvsAp3","陸上はこの人に負けたくない！はもちろんあるけど、自分がどれだけタイムを縮められるかの戦い。
バスケはその時その時の状況に合わせて、プレーは変わるし、臨機応変が求められる。

ビジネスは更に変化に適応することが大事！#mgtorg2024"
"2024-12-10","11:05:35","上腕三頭筋@jo13tokin","仕事は！#mgtorg2024"
"2024-12-10","11:05:44","ボウルサラダボウル@SiTiMiY4_ch","#mgtorg2024業界にもよるんだけど、トレンドが変わるの早いからより判断力が求められる気がするし、応用力も基礎力も成長が必要な気がしている💪"
"2024-12-10","11:05:54","やや@afvvfxcgrec","寒いので日光にあたりながら授業受けてます。#mgtorg2024"
"2024-12-10","11:06:11","harunchu@hamunin331","トライすれば何かしら結果が出る#mgtorg2024"
"2024-12-10","11:06:44","プロガムラー@googlevsapplevs","8月から就活とか社会人になったら役立つと思って、コールセンターのバイト始めた。
最初はマニュアルでスクリプト通り読んでたからイレギュラーな時に対応がぎこちなくなってた 。
今は3ヶ月経ってそれぞれのお客さんに臨機応変な対応することが出来てる。
これが熟達化か#mgtorg2024"
"2024-12-10","11:07:40","まる@oDApfas7DPvsAp3","まずはとりあえずやってみることから

カフェゼミ準備の時もそうだったけど、頭ですごく考えてイメージできてても、実際にやってみると「あれ、ここってどうすれば！？」みたいなのがたくさん出てくる。
だから、実際にやってみるってすごく大事。#mgtorg2024"
"2024-12-10","11:07:49","ペパーミント@If8Rywjdt","自分の経験から自分なりの知識を作る！
実践して終わり！じゃだめ。#mgtorg2024"
"2024-12-10","11:07:51","こんぺい@yu813508346040","経験したときの事実だけを詳細に記憶するのではなく、そのときどう感じたか、どう考えたかも細かく言語化することを忘れないようにしたい！
この前のカフェゼミで気づいたこと！#mgtorg2024"
"2024-12-10","11:08:37","味噌ラーメン@yuta_mgtorg2024","経験学習はやり終わった後の方が大事#mgtorg2024"
"2024-12-10","11:09:16","やや@afvvfxcgrec","自分はストレッチ経験があるかなと振り返ってみたけどあまりストレッチ経験できてないと思った。#mgtorg2024"
"2024-12-10","11:09:37","さとう@i029460965472","まずやってみる、終わった後に考える#mgtorg2024"
"2024-12-10","11:09:55","上腕三頭筋@jo13tokin","まずやってみる
終わってみたら考える
これが経験学習#mgtorg2024"
"2024-12-10","11:10:06","ボウルサラダボウル@SiTiMiY4_ch","#mgtorg2024経験学習
→楽をしない+ヨッシー並のふんばり"
"2024-12-10","11:10:28","けいたつ I 若者の機会損失をゼロにする@_kk_marumaru","投げ出しそうになるときってありますよねーいかにその時に踏ん張るか
僕は100回倒れても101回立ち上がるを信念のひとつにしてますっ#mgtorg2024"
"2024-12-10","11:11:14","まめきち@mamekiti_hamham","note.com/pure_wren1813/…カフェゼミでしたストレッチ経験を仲間がまとめてくれてる

ほんとに仲間って大切なんだよな#mgtorg2024"
"2024-12-10","11:11:22","しずの@ofRKrrWtqa87140","バイト中、マニュアルじゃ対応出来ないような状況を切り抜けた後、先輩とかと「あれってどーすりゃ良かったんですかねぇ？」って感じで話し合って省察するのは結構好き#mgtorg2024"
"2024-12-10","11:12:05","まる@oDApfas7DPvsAp3","高校の時陸上やってたけど、コロナ禍で部活できなくて、自主練しなきゃいけない期間辛かったな。確かに走るのは1人だし、個人の戦いの部分も大きいけど、誰かと一緒に練習して、辛いも楽しいも共有できたから頑張てたな🏃‍♂️#mgtorg2024"
"2024-12-10","11:12:17","harunchu@hamunin331","今になってやりたいことが見つかったから間に合うかわからないし、できるかわからないけどとりあえずやってみようと思う#mgtorg2024"
"2024-12-10","11:14:15","プロガムラー@googlevsapplevs","筋トレもストレッチと収縮が大事#mgtorg2024"
"2024-12-10","11:17:30","ボウルサラダボウル@SiTiMiY4_ch","#mgtorg2024今のガーン😨ってやつ
授業内で効果音を用意しとくの面白そう。
ボタン押すだけみたいに準備しといて"
"2024-12-10","11:19:19","こんぺい@yu813508346040","自分で決断しようとはしているけど、無意識に責任を人任せにしてるのかなーー#mgtorg2024"
"2024-12-10","11:21:19","まる@oDApfas7DPvsAp3","🙅🏻‍♀️「問題は与えられる」という前提
頭を使って色々な選択肢を考ることは大事。けど、やっぱり自分だけではたくさんの場合を考えきれていなかったり、危機管理できてなかったりする。でも、仲間がいて、色んな角度から考えられるし、「これは！？」と教えてくれる。#mgtorg2024"
"2024-12-10","11:22:29","味噌ラーメン@yuta_mgtorg2024","創造性＝自分で考えよう・自分の意見をもとう#mgtorg2024"
"2024-12-10","11:22:35","しずの@ofRKrrWtqa87140","「〜で良いんですか？」ってのは正直自分もよくやる
昔は自分で正しいと思うことを貫けてた気がするけど、小中学で矯正されまくって、不正解ってモノに過度に怯えるようになってしまったんだよな#mgtorg2024"
"2024-12-10","11:22:44","味噌ラーメン@yuta_mgtorg2024","経験学習＝そのための練習？#mgtorg2024"
"2024-12-10","11:22:47","さとう@i029460965472","創造性
×奇抜なことをする
○自分で考える、雰囲気に流されない#mgtorg2024"
"2024-12-10","11:24:16","ペパーミント@If8Rywjdt","「楽しむように働く」。
価値を生み出す、世の中の役に立つことをどうやって楽しんで作れるか。
これこそ「シリアスファン」#mgtorg2024"
"2024-12-10","11:26:22","あもーれ@1sfzWkHIGu6XdGs","1年弱の授業を経て、みんなのツイートの中に少しづつ授業で扱った概念が見え始めてきているのはまさに学習だなぁ。それぞれの意見に沿った形でその概念を扱えているのもすごいことだ。#mgtorg2024"
"2024-12-10","11:26:28","上腕三頭筋@jo13tokin","仕事は他社の役に立つこと
自分がざっくりやりたいことは、やっぱり他者への奉仕というか、他の人のためのものだな〜#mgtorg2024"
"2024-12-10","11:27:18","味噌ラーメン@yuta_mgtorg2024","ルールや状況が同じなら、経験学習が超進む
…けど現実はそんな簡単じゃない！#mgtorg2024"
"2024-12-10","11:27:41","味噌ラーメン@yuta_mgtorg2024","この前の経験からこうすべきだ！ができなくなる感じ？#mgtorg2024"
"2024-12-10","11:28:14","さとう@i029460965472","AI評価でどっちが有利か見れるようになってからちょっとだけ将棋見るようになった#mgtorg2024"
"2024-12-10","11:28:19","あもーれ@1sfzWkHIGu6XdGs","最近のFPSや格闘ゲームといったオンラインゲームとかだとよくルールとかの調整が定期的に入ってる気がする。その道のプロは適応的熟達者なのかも？#mgtorg2024"
"2024-12-10","11:28:57","ボウルサラダボウル@SiTiMiY4_ch","#mgtorg2024スマブラのスティーブを使えないベテランみたいな感じか"
"2024-12-10","11:30:27","けいたつ I 若者の機会損失をゼロにする@_kk_marumaru","特に国の法規制なども頻繁に変わってるから常に学び情報収集し続けないと終わるよねぇ#mgtorg2024"
"2024-12-10","11:30:51","ペパーミント@If8Rywjdt","「何かを捨て去る」ことも大事#mgtorg2024"
"2024-12-10","11:31:06","味噌ラーメン@yuta_mgtorg2024","外部環境が変化して使えなくなった習慣や価値観を切り替える、という意味での棄却#mgtorg2024"
"2024-12-10","11:31:08","あもーれ@1sfzWkHIGu6XdGs","時代の変化、ゲームルールの変更の中で徐々にパイが小さくなる既存のフィールドを探し続けるのか、新しいフィールドに足を踏み込み適応し続けるのか。自身のエネルギーをどっちに使うかで10年先は大きく違いそうだね。#mgtorg2024"
"2024-12-10","11:31:09","インドアなアウトドア派@indoornaoutdoor","ゲームの変更で、自分の知識を捨てるのはなかなか勇気のいることだなぁ...#mgtorg2024"
"2024-12-10","11:31:21","ペパーミント@If8Rywjdt","「変化」に対応する。
自分の常識を変えることも必要#mgtorg2024"
"2024-12-10","11:31:24","味噌ラーメン@yuta_mgtorg2024","今日の正解が明日の不正解になり得るってことか#mgtorg2024"
"2024-12-10","11:32:15","しずの@ofRKrrWtqa87140","紙のTCGと、僅かにルールが異なるアプリ版のDCGがあって、ずーっとDCGやってた人が紙版を始めてくれた。でもDCGの方のルールにめちゃくちゃ囚われてて「なんでそんなに出来ないんだ…？」って不思議に思ってたけど…自分が思ってるよりも、蓄積したモノの影響って重いのかな#mgtorg2024"
"2024-12-10","11:32:24","まめきち@mamekiti_hamham","成功体験に頼りたくなる
もう一回やりたいって思うけどその経験を捨ててまたやり方を試行錯誤する段階に戻る勇気をもたないといけない#mgtorg2024"
"2024-12-10","11:33:15","インドアなアウトドア派@indoornaoutdoor","自分の学んだ知識を捨てることで今まで何をやっていたんだろうという虚無感に浸ってしまうかも...#mgtorg2024"
"2024-12-10","11:33:17","味噌ラーメン@yuta_mgtorg2024","捨てる＝やめる、ではなく、変化する・変わる、という感じ？#mgtorg2024"
"2024-12-10","11:33:41","まる@oDApfas7DPvsAp3","日本、過去に縋ってる？#mgtorg2024"
"2024-12-10","11:34:08","ぽぽ@XcClFOZXcL85543","今までのやり方を捨てるのって、今までの自分が間違っていたと認めるような気がしてしまう

でもそんなことはなくて、新しいやり方に切り替えることでさらに成長できるはず
できるようになりたい#mgtorg2024"
"2024-12-10","11:34:15","上腕三頭筋@jo13tokin","アンラーニング！なるほど！
禅のマスター、Oshoも「知識は死んだもの、ガラクタだ。捨てねばならない。そして自分の中から湧き上がったものだけを残せ。」みたいなこと言ってた！#mgtorg2024"
"2024-12-10","11:34:57","あもーれ@1sfzWkHIGu6XdGs","これか？www2.nhk.or.jp/archives/movie…#mgtorg2024"
"2024-12-10","11:35:30","まる@oDApfas7DPvsAp3","前に上手くいったものがあると、新しいことに挑戦するより前と同じことをやろうとする。でもやっぱり難しくても挑戦を選びたいし、その方が面白い。
迷ったら難しい方、面白い方、挑戦できる方を選ぶ！
てかそもそも、前に上手くいったからって、次も上手くいくとは限らないのにね。#mgtorg2024"
"2024-12-10","11:36:02","ペパーミント@If8Rywjdt","明治、割り切ってたんだ#mgtorg2024"
"2024-12-10","11:36:18","インドアなアウトドア派@indoornaoutdoor","ルールの変更で学習棄却をすることをマイナスに考えるのではなく、新しいことを学ぶ事を喜べるという考え方ができるといいなぁ...#mgtorg2024"
"2024-12-10","11:36:52","まめきち@mamekiti_hamham","「意見は変わる」
前はああ言ってたのに…！って後ろ指刺されることもあるけど、周りが変わって知識量も変われば意見も変わるよね
堂々と自分の意見を言うことが大事#mgtorg2024"
"2024-12-10","11:36:59","あもーれ@1sfzWkHIGu6XdGs","その割り切りのスローガンが「富国強兵」だったんだろうな。#mgtorg2024"
"2024-12-10","11:37:10","ペパーミント@If8Rywjdt","「翻訳主義」。。
翻訳主義の罠もありそうだなぁ#mgtorg2024"
"2024-12-10","11:37:38","しずの@ofRKrrWtqa87140","アンラーニングってただ棄てるってよりは、あくまでアップデートって捉え方しとくくらいが、分かりやすくて気楽で良いかな？齟齬がなければ…だけど（）#mgtorg2024"
"2024-12-10","11:39:01","インドアなアウトドア派@indoornaoutdoor","韓国では化学用語を英語のまま学んでいるという話を聞いたことがある
外国語の翻訳や日本語で新たな言葉を作るのは本当に難しいことなんだろうな#mgtorg2024"
"2024-12-10","11:39:29","ky@ky3754403794","明治維新の成功要因は短期間の詰め込み型教育や新しい知識を日本語に翻訳したことで、日本人全員が世界の先端的な知識を学ぶことができたのが成功要因だということは盲点だった。#mgtorg2024"
"2024-12-10","11:39:42","ボウルサラダボウル@SiTiMiY4_ch","#mgtorg2024翻訳主義→英語わかんない人も読めたのもそうだろうけど、日本向け(日本のサイズ、文化)に訳されたこともあったんじゃないかと思う"
"2024-12-10","11:40:43","ペパーミント@If8Rywjdt","「成功例」を繰り返した。それによる弊害は、今の日本の経済競争力低下に顕著に現れてるなぁ#mgtorg2024"
"2024-12-10","11:41:30","ボウルサラダボウル@SiTiMiY4_ch","#mgtorg2024今更だけど、「変わらない強み」はどこいった？

化石みたいな日本が変わらず20年後とかに役立つ可能性はないのだろうか？"
"2024-12-10","11:41:40","味噌ラーメン@yuta_mgtorg2024","成功体験に固執しすぎることで、そこから脱却することが難しい
＝有能さの罠#mgtorg2024"
"2024-12-10","11:42:04","ぽぽ@XcClFOZXcL85543","成功のしすぎは、やり方の変更を難しくする

人生でも言えそう#mgtorg2024"
"2024-12-10","11:42:09","さとう@i029460965472","翻訳技術に支えられて今の日本がある
納得すぎる視点#mgtorg2024"
"2024-12-10","11:42:16","インドアなアウトドア派@indoornaoutdoor","有能さの罠は、過去の成功体験に引っ張られすぎたという事なのか#mgtorg2024"
"2024-12-10","11:42:20","味噌ラーメン@yuta_mgtorg2024","たしかに、ちょっと失敗したくらいじゃ「いやたまたま失敗しただけだから次こそはいける！」ってマインドになりそう#mgtorg2024"
"2024-12-10","11:42:43","さとう@i029460965472","成功体験に縋りたくなる気持ちしかない#mgtorg2024"
"2024-12-10","11:42:57","ペパーミント@If8Rywjdt","北欧では、映画上映に吹き替えがないって聞いたことある。だから英語を話せる人も多いって。

日本は海外のコンテンツも「日本語」で楽しむことに慣れてしまっている。これも「成功例」による弊害かな#mgtorg2024"
"2024-12-10","11:43:39","しずの@ofRKrrWtqa87140","何だか破壊的イノベーションだとかに似たような性質だな
成功体験があると、どうしてもそれまでのやり方に拘りたくなってしまって、革新的な技術が出てもその波に乗れないで取り残される…ってやつ
まぁこれもアンラーニング出来るか出来ないかってやつか#mgtorg2024"
"2024-12-10","11:43:44","味噌ラーメン@yuta_mgtorg2024","直感として、大きな成功を達成したら、そのやり方をやめるのはいいことには思えないけど、
変化し続けてる世の中っていう前提を考えたら話は違うかも#mgtorg2024"
"2024-12-10","11:44:40","味噌ラーメン@yuta_mgtorg2024","成功した要因は何か、どんな「型」で成功したのか、振り返ることが大事なんだな#mgtorg2024"
"2024-12-10","11:45:28","まる@oDApfas7DPvsAp3","いくら過去にすっごい成功してても、また同じように成功できるとは限らないのに、、、
頭では分かっていても、行動できるかどうか。方向転換で新しいことに挑戦できるか#mgtorg2024"
"2024-12-10","11:49:00","味噌ラーメン@yuta_mgtorg2024","学ぶ＝良くも悪くも組織に染まる？#mgtorg2024"
"2024-12-10","11:49:56","あもーれ@1sfzWkHIGu6XdGs","ある意味で、この授業を受講し、この共同体で学習したからこそ、「この授業で扱う概念を重視したい」という振る舞いが自然と身についているのかもしれない。#mgtorg2024"
"2024-12-10","11:50:34","まる@oDApfas7DPvsAp3","最初に組織に対して疑問があっても、そこにいるうちに組織に染められていく。感じていた疑問も知らぬ間に消えていく。#mgtorg2024"
"2024-12-10","11:51:10","プロガムラー@googlevsapplevs","のぼせる人間シンドローム#mgtorg2024"
"2024-12-10","11:51:22","ぽぽ@XcClFOZXcL85543","組織にいると、組織によってあるべき姿が決まってる

染まるまでの間の、自分の理想とか価値観とずれているときがきつそう#mgtorg2024"
"2024-12-10","11:51:26","ボウルサラダボウル@SiTiMiY4_ch","#mgtorg2024抗体持ち蛙x.com/sitimiy4_ch/st…"
"2024-12-03","11:30:44","ボウルサラダボウル@SiTiMiY4_ch","#mgtorg2024ゲストの方たちも一度会社に入ってるけど、創造性を失わなかったからこそ、ナレッジワーカーになれたんだと思う。

だから、この講義の内容をその時まで覚えてることが大事"
"2024-12-10","11:51:41","ペパーミント@If8Rywjdt","今のゼミの組織の感じで、日本の官僚制組織に入ったらそのギャップを感じてしまいそう。
企業に入っても「気がついたら染まってた…」ってことがないように生きていきたい！#mgtorg2024"
"2024-12-10","11:52:35","ペパーミント@If8Rywjdt","「茹で蛙」にならない為の「予防」。
その為に、「外部のネットワーク」を持っておくとか？#mgtorg2024"
"2024-12-10","11:52:57","まる@oDApfas7DPvsAp3","染まらないようにするためにも、外部とのネットワークって大事じゃない！？自分の当たり前が、当たり前じゃなかったことに気づける！#mgtorg2024"
"2024-12-10","11:54:19","こんぺい@yu813508346040","茹で蛙シンドローム
ひとつの組織に依存しすぎていると、絶対的にそれが正しいと盲目的になってしまいそう
他の人とも交流すること、意見を素直に聞いてみることも大事にしたい#mgtorg2024"
"2024-12-10","11:56:47","あもーれ@1sfzWkHIGu6XdGs","外部のネットワークは向こうからやってこない。 カフェゼミのゲストの西さんも同じようなことを言っていた。自分から飛び込んでみる、出会いをきっかけにすることを忘れずにしたいね。#mgtorg2024#melc2024"
