date,time,account,text
2024-10-08,09:55:08,長岡 健@TakeruNagaoka,"経営組織論（第３回）「組織のフラット化・ネットワーク化」#mgtorg2024おはようございます。今日は雨。気温もだいぶ下がったようです。我が家のネコたちも秋🍂の昼寝場所、今日からクロークの中です。

こういう日の授業には温かい飲み物をもって集まりましょう。

さあ今日も楽しく学ぼう！pic.x.com/duLZLoF66L"
2024-10-08,10:35:13,ひの@hosei_univ_3,今日も出席！#mgtorg2024
2024-10-08,10:39:22,noir@hoseinoir,#mgtorg2024今日は対面で行こうと思ってたけど全く外に出れる体調じゃなくてオンライン……
2024-10-08,10:43:20,まる@oDApfas7DPvsAp3,"おはようございます☀️
飲み物は常温！#mgtorg2024"
2024-10-08,10:44:28,ペパーミント@If8Rywjdt,おはよう🌞今日のお供#mgtorg2024pic.x.com/GQidEOrbV7
2024-10-08,10:47:11,まめきち@mamekiti_hamham,"おはようございます！
今日は雨だけど涼しくて家出ようって気分になれた〜！#mgtorg2024"
2024-10-08,10:47:33,てでぃ@yuan_nai44435,おはようございます！対面で受ける気満々でしたがこの天気、、、来週は対面で受けれたらなと思います！#mgtorg2024
2024-10-08,10:48:48,あもーれ@1sfzWkHIGu6XdGs,参加者を待機室に戻すの結構メンタルにくるので、できればみんなルールを守って欲しいなｧ…。#mgtorg2024
2024-10-08,10:48:59,インドアなアウトドア派@indoornaoutdoor,zoomってアバター機能ありましたっけ？#mgtorg2024
2024-10-08,10:49:11,しずの@ofRKrrWtqa87140,確かに考えてみればアバターなんてのもあるのか…これもオンラインの可能性かね#mgtorg2024
2024-10-08,10:53:05,あもーれ@1sfzWkHIGu6XdGs,同じ時間、同じ場所に集まるってことを大切にするからこそ、そうできない場合はまた違った参加をしてほしいってことだね。気を悪くしないで欲しいな。#mgtorg2024
2024-10-08,10:57:50,うちだ@uchi_da0808,#mgtorg2024確かにプロデューサーって具体的に何をする仕事なのか知らないな
2024-10-08,10:58:43,noir@hoseinoir,#mgtorg2024プロデューサー、確かにアイマスくらいの印象しか無くて笑う
2024-10-08,10:58:43,Metallica@dsmpG44yCS3083,#mgtorg2024もうそろそろ起きるのが辛い時期になってきたな…寒い🥶
2024-10-08,10:58:45,プリン@DFJCjy4gHbruyGo,"おはようございます☔️
今日も遅延して間に合うか微妙だったけど、ピッタリ間に合った＾＾#mgtorg2024"
2024-10-08,10:59:39,竹@hundred_bamboo,常温の飲み物買いたいけど、水かお茶の2択しかなく、コンビニだとあったかいの少ししかないから仕方なく冷#mgtorg2024
2024-10-08,11:00:53,harunchu@hamunin331,この授業受けるといつも大学一年の時を思い出す#mgtorg2024
2024-10-08,11:02:18,Metallica@dsmpG44yCS3083,#mgtorg2024流れる時代にどう対応するか。まぁいろんな方法を試していかないと答えは出ないんだろうな。
2024-10-08,11:02:19,ペパーミント@If8Rywjdt,正解のない世界をどう生きるかか…#mgtorg2024
2024-10-08,11:03:29,駆け抜けろ！トランジスタくん！@transistor_y,おはようございます😃10/1に内定式があった影響で第0回のレポート出せてないけど後期も張り切って履修するぜ#mgtorg2024
2024-10-08,11:03:37,noir@hoseinoir,"#mgtorg2024文化が違うというのもこれになるのかな
なんとなく思い出したけど、バイト先の中国人の人が夏帰省しててこっちに戻ってきてお土産を事務所においてたんだけど、それがまさかのティーバッグで日本人には無い発想過ぎてびっくりしたなあ"
2024-10-08,11:04:29,Metallica@dsmpG44yCS3083,#mgtorg2024働きたくねぇなぁ…
2024-10-08,11:04:41,駆け抜けろ！トランジスタくん！@transistor_y,大学入ってから一番おもろい授業#mgtorg2024
2024-10-08,11:05:33,味噌ラーメン@yuta_mgtorg2024,この導入を聞くと、失敗しないことよりも、時代に遅れないようなスピード感が大事に感じるな。#mgtorg2024
2024-10-08,11:07:28,Metallica@dsmpG44yCS3083,#mgtorg2024自分は50人くらいが限界かも…
2024-10-08,11:07:56,まる@oDApfas7DPvsAp3,"40人のゼミって高校のクラスじゃん、
規模でか！って思ってしまう！#mgtorg2024"
2024-10-08,11:08:24,ボウルサラダボウル@SiTiMiY4_ch,#mgtorg2024私も管理…顔と名前覚えられるの30人くらいな気がする(クラスくらい)
2024-10-08,11:08:36,こんぺい@yu813508346040,何万人何十万人規模の会社、経営戦略は9人くらいで意思決定してるって言ってたなあ#mgtorg2024
2024-10-08,11:08:42,あもーれ@1sfzWkHIGu6XdGs,「自分がいなくても仕事は回る」って個人的には微妙な感覚だけど、組織としてはとても心強いことだよね。#mgtorg2024
2024-10-08,11:09:19,しずの@ofRKrrWtqa87140,自分は4人くらい束ねられれば上々って位かなぁ😇人を扱うことって難しいし、そも顔と名前を一致させて覚えるのが苦手すぎる…！#mgtorg2024
2024-10-08,11:09:20,竹@hundred_bamboo,年々人の名前と顔を一致させる力が衰えてきて、高校三年生の時はクラスも怪しかった…一回会った人の名前と顔を覚えられる人本当にすごいし、社会人やる上で強みになりそうだと思う#mgtorg2024
2024-10-08,11:09:40,まる@oDApfas7DPvsAp3,ゼミは集団に近いね#mgtorg2024
2024-10-08,11:10:46,味噌ラーメン@yuta_mgtorg2024,"生産性の話を聞くと、失敗しないことの方が大事に思えるな。笑
脱・二元論にならねば！笑#mgtorg2024"
2024-10-08,11:11:06,カープ@PgjCrf,ネットの状況悪くてカクカク、、、#mgtorg2024
2024-10-08,11:11:52,ボウルサラダボウル@SiTiMiY4_ch,#mgtorg2024タイムリーに昨日面接した人事の方も、「社員が変えのきく歯車である事が重要だけれども、そうでありたくない」ってジレンマ抱えてた
2024-10-08,11:12:16,味噌ラーメン@yuta_mgtorg2024,"ミスが「ない」のではなく、あくまで「少ない」なのか。
ミス＝大損、みたいなイメージがあった😅#mgtorg2024"
2024-10-08,11:12:31,まる@oDApfas7DPvsAp3,"簡単なこと(誰でも出来ること？)をずっとやる
工場みたいな作業をイメージ#mgtorg2024"
2024-10-08,11:12:49,Metallica@dsmpG44yCS3083,#mgtorg2024分業するためにはみんなができるマニュアルを作らないといけないんだよな。だから力のある人は成長できないんだよな。
2024-10-08,11:13:36,土方@ryunen_shimamu,アメリカの戦車はどんな馬鹿にでも読めるくらい分かりやすいマニュアルがついてるってきいたことあるな#mgtorg2024
2024-10-08,11:13:44,あもーれ@1sfzWkHIGu6XdGs,自衛隊に訓練なんてまさにそうだったな。「これをすれば誰でもできるようになる」って確信した。大体は単純作業だけど、欠かせない。#mgtorg2024
2024-10-08,11:13:55,味噌ラーメン@yuta_mgtorg2024,「分業関係＝誰だってできる」 の状況において、「私じゃないといけない！」を出すの難しいな。たしかにやる気につながらない。#mgtorg2024
2024-10-08,11:14:27,ペパーミント@If8Rywjdt,分業、単純化された作業だけをやりつづけて、「自分は仕事ができるわ」と勘違いしてしまっているといつまで経っても成長できないんだろうなぁ…#mgtorg2024
2024-10-08,11:15:19,味噌ラーメン@yuta_mgtorg2024,マニュアルワークになるからこそ、仕事を軽視してミスにつながる気もするな#mgtorg2024
2024-10-08,11:16:00,うちだ@uchi_da0808,#mgtorg2024近年求められてる高度さ&クリエイティビティが求められる仕事と生産性重視の組織管理は相性悪い？
2024-10-08,11:16:15,味噌ラーメン@yuta_mgtorg2024,"マニュアルワークだったとしても、それを行うのは一人の人間であることは前提に置かないといけないのでは？
ミスる、サボる…みたいな#mgtorg2024"
2024-10-08,11:17:16,Metallica@dsmpG44yCS3083,#mgtorg2024この組織のリーダーやりたくねぇな。1人だけ労働量おかしいよな。
2024-10-08,11:17:43,ぽぽ@XcClFOZXcL85543,"確かにグループワークしてると「モヤモヤするけど、言ったら面倒くさいって思われる…？？」と考えて言えないことがある
大きな事態になる前に言えるようにならないとなぁ…#mgtorg2024"
2024-10-08,11:17:51,ペパーミント@If8Rywjdt,権限が統制されすぎるのも良くない？？#mgtorg2024
2024-10-08,11:18:10,プリン@DFJCjy4gHbruyGo,"組織として、ミスをした時のためのことも考えておく
聞いた人によって言うことが違くて困るってことが少なくなるよね#mgtorg2024"
2024-10-08,11:19:17,まる@oDApfas7DPvsAp3,"バイトしてる塾は、権限統制曖昧のかも。
誰の指示に従うかは決まってるけど、責任は、、、
ミスの話じゃないかもだけど、塾辞めたいって思ってる子に退塾届け渡すのバイトの友達がやらされてた。
これってめちゃくちゃ責任あるものだし、バイトがやることでない気がしてた、、、#mgtorg2024"
2024-10-08,11:19:28,味噌ラーメン@yuta_mgtorg2024,"官僚型組織
…せっかくの文書主義のはずが、黒塗りだったり隠蔽されたり、滅茶滅茶だな。笑#mgtorg2024"
2024-10-08,11:19:47,あもーれ@1sfzWkHIGu6XdGs,『シン・ゴジラ』なんかも未曾有の危機に対する官僚制組織の動きの遅さが丁寧に描写されていたなぁ。#mgtorg2024
2024-10-08,11:19:52,ペパーミント@If8Rywjdt,官僚型組織って言葉。「官僚」って言葉に嫌なイメージがついてきたのも最近だよね、、#mgtorg2024
2024-10-08,11:19:54,竹@hundred_bamboo,文書主義大事だなとひしひしと感じる。全員忘れっぽい我が家、いつも言った言ってないでずーーーーっと揉めてるから文書主義取り入れたいけどめんどくさがり集団でもあるので最近は決定事項、大事な話をLINEに残すようになった笑笑#mgtorg2024
2024-10-08,11:20:18,Metallica@dsmpG44yCS3083,#mgtorg2024ミスが少なく変化もない時代なら生産性をあげれる官僚制はめっちゃ強い気がする。
2024-10-08,11:20:37,さとう@i029460965472,"事件は会議室で起きてるんじゃない
現場で起きてるんだ#mgtorg2024"
2024-10-08,11:20:43,味噌ラーメン@yuta_mgtorg2024,"踊る大捜査線！母の影響で見てた。
織田裕二かっこいい！笑#mgtorg2024"
2024-10-08,11:21:07,まめきち@mamekiti_hamham,"踊る大捜査戦聞いたことある。
見てみたいな#mgtorg2024"
2024-10-08,11:21:20,ボウルサラダボウル@SiTiMiY4_ch,"#mgtorg2024踊る大捜査線は、ガチガチに官僚制だった
権限関係とかが印象に残ってる

公務員で官僚制じゃないことあるのかな？"
2024-10-08,11:22:01,うちだ@uchi_da0808,#mgtorg2024日本の会社って官僚型組織ばかりな気がするけど、生産性重視の産業が強い時代の名残なのかな？
2024-10-08,11:22:07,土方@ryunen_shimamu,確かに昔の方が刑事ものドラマ多かったな#mgtorg2024
2024-10-08,11:22:34,あもーれ@1sfzWkHIGu6XdGs,基本的に組織が大規模になればなるほど、できることは大きくなるし、影響力も大きくなる。より大きく、を目指し、それを円滑に動かそうとするのは当然の帰結ではあるよね。#mgtorg2024
2024-10-08,11:23:08,Metallica@dsmpG44yCS3083,消費者のニーズが増えすぎたせいで、とりあえず大量に作っとけばいいやのやり方は通用しなくなってるのかも。#mgtorg2024
2024-10-08,11:23:10,味噌ラーメン@yuta_mgtorg2024,品質と効率だけのことではないけど、トレードオフの関係って本当に難しい。#mgtorg2024
2024-10-08,11:23:16,ペパーミント@If8Rywjdt,「白い巨塔」とかも官僚制描かれてるよね#mgtorg2024
2024-10-08,11:23:37,うちだ@uchi_da0808,#mgtorg2024結局コモディティ化の話に繋がってくる訳かあ
2024-10-08,11:23:38,プリン@DFJCjy4gHbruyGo,ミスしないことを目指すと、クオリティが下がってくる。そう思うと分業よりひとりの人が集中した方がクオリティが上がるのではないのか。#mgtorg2024
2024-10-08,11:24:38,まる@oDApfas7DPvsAp3,分業だけになると、お互いが何やっているのか、何を考えて行動してるのか全然分からないから、分業化でみんなでいいものを作るって難しいよね。#mgtorg2024
2024-10-08,11:25:25,Metallica@dsmpG44yCS3083,#mgtorg2024変化に対応しないといけないけど、でもいつ変化すればいいのかは誰にもわからないからそのタイミングが難しいよな。
2024-10-08,11:25:29,インドアなアウトドア派@indoornaoutdoor,少品種大量生産から多品種少量生産への移行で、機械的な作業の幅が広がったことから品質が落ちてしまったことも原因にあるかも...#mgtorg2024
2024-10-08,11:25:46,まる@oDApfas7DPvsAp3,"でもやることが多くて、人も多かったら、分業しなかったら全然やること進まないし、分業化も大事になってくる！
絶対このバランス難しい、、、#mgtorg2024"
2024-10-08,11:26:21,ケーキ@FTnofEyXI030604,分業の配分って難しい。任せすぎても任せなすぎても捉え方次第で自信無くしちゃったり責めらてるって思われる可能性がある#mgtorg2024
2024-10-08,11:26:28,しずの@ofRKrrWtqa87140,"この間読んだ本で、日本社会で量的充足から質的充足が求められるようになっていく変遷を書いたのがあったな
色んなものがコモディティ化してきたし、売ったら売れるって時代じゃねんだなぁ#mgtorg2024"
2024-10-08,11:26:34,うちだ@uchi_da0808,#mgtorg2024リーダーとして求められる判断力がますます上がってきてる訳か、恐ろしい・・・
2024-10-08,11:26:34,プリン@DFJCjy4gHbruyGo,確かにバイトで人に頼むよりも、自分でやった方が早いから一人でやっちゃうこと多いや、、口で伝えるより行動するのを優先してしまう#mgtorg2024
2024-10-08,11:27:18,味噌ラーメン@yuta_mgtorg2024,"マニュアルワークで実現できる慎重さ
スピーディーな対応のためには、 両立はできない#mgtorg2024"
2024-10-08,11:27:42,味噌ラーメン@yuta_mgtorg2024,"多少のミスを許容できるか？
許容の範囲も違うし、多少のニュアンスも違うよなぁ…#mgtorg2024"
2024-10-08,11:27:56,さとう@i029460965472,早さは魅力的だけどリスクも大きい#mgtorg2024
2024-10-08,11:28:58,こんぺい@yu813508346040,"リーダー役の人も、自分がどれだけ忙しくても全てを把握してないと気が済まない人がいる
どこまで信頼できるか、信頼してもらえるか難しい#mgtorg2024"
2024-10-08,11:29:12,味噌ラーメン@yuta_mgtorg2024,"提供スピード爆速でもマズイ牛丼屋に行きたいとは思わないな。笑
妥協点を見つけられるか、がカギ？#mgtorg2024"
2024-10-08,11:29:18,ペパーミント@If8Rywjdt,意思決定のスピードと即興性。#mgtorg2024
2024-10-08,11:29:23,あもーれ@1sfzWkHIGu6XdGs,ミスがないこと（完璧性）とスピードが速いこと（迅速性）のトレードオフ。とはいえ、二元論に陥るのではなく、いい塩梅を探していかないといけない。#mgtorg2024
2024-10-08,11:29:46,まめきち@mamekiti_hamham,"挑戦できる環境ありますっていう会社増えてきてるイメージ。
それに魅力を感じる学生は私も含めて結構いる気がする#mgtorg2024"
2024-10-08,11:30:00,Metallica@dsmpG44yCS3083,#mgtorg2024スピードと品質をバイトに求めるのは結構酷な気がするな…
2024-10-08,11:30:16,まる@oDApfas7DPvsAp3,"どれだけスピードを求めるのか、どれくらいのミスを許容するのか、
基準も、これが正しいってのもないから、誰かが判断しなければいけない。#mgtorg2024"
2024-10-08,11:31:30,味噌ラーメン@yuta_mgtorg2024,安定的＝人材が代替可能？#mgtorg2024
2024-10-08,11:31:57,うちだ@uchi_da0808,#mgtorg2024話聞いてるとバイトで培った経験は自分が思う以上に今後の役に立つ気がしてきた。やっぱりリーダーシップを身に付けるには経験あるのみ！
2024-10-08,11:32:17,Metallica@dsmpG44yCS3083,#mgtorg2024有機的な組織の方が良さそうだけどそんな優秀な人材滅多に居ないよな…
2024-10-08,11:32:20,ボウルサラダボウル@SiTiMiY4_ch,"#mgtorg2024某回転寿司チェーンアルバイトにて…
一生困ったのはキッチンが間違えた作ったのを、ホールが客に呼び出されるんだけども、次はキッチンが注文履歴から作るんじゃなくて、ホールで聞いてこいってスタイルなのが困った🥺

匙加減的に、キッチンはミスっても早く出すを優先してるのか？"
2024-10-08,11:32:34,プリン@DFJCjy4gHbruyGo,人材の依存度が高い有機的組織はなかなかリスク高そう、？#mgtorg2024
2024-10-08,11:33:26,さとう@i029460965472,マニュアルは「選択」の負担を軽減してくれる#mgtorg2024
2024-10-08,11:33:31,味噌ラーメン@yuta_mgtorg2024,"塩梅を決める・選択をする
…いろいろな状況を「知る」ことから始めないといけないよな。知らないことは選べない#mgtorg2024"
2024-10-08,11:33:49,竹@hundred_bamboo,臨機応変、判断力がリーダーの必携能力になっていくのか…うーん…苦手だ…#mgtorg2024
2024-10-08,11:33:54,土方@ryunen_shimamu,"機械的な組織作る方が楽そうだけど優秀な人は集まらなくなりそう
それとも機械的組織だから優秀な人いらねえのか？#mgtorg2024"
2024-10-08,11:34:41,ペパーミント@If8Rywjdt,"絶対の勝利の方程式はないか…
企業の成功例、成功者ばかりを追っていると見えなくなるものがあるのかも。やはり実践あるのみだなぁ#mgtorg2024"
2024-10-08,11:35:00,まめきち@mamekiti_hamham,いろんなやり方で受験的にやってみる、試行錯誤をしていかないといい塩梅わかんかいよなぁ#mgtorg2024
2024-10-08,11:35:47,Metallica@dsmpG44yCS3083,#mgtorg2024日本がダメになったのではなく、環境が変わって対応が追いついてないのが現代なのか。
2024-10-08,11:35:53,こんぺい@yu813508346040,"例外が増えてきた？
トラブルが増えてきた？
社会が複雑化したから？#mgtorg2024"
2024-10-08,11:37:08,Metallica@dsmpG44yCS3083,#mgtorg2024現代は多様な価値観があるから一つのものを安定的に生み出したところであんま利益は出せなくなってるのかも。
2024-10-08,11:37:19,インドアなアウトドア派@indoornaoutdoor,現代はVUCAと言われているらしい#mgtorg2024
2024-10-08,11:37:41,味噌ラーメン@yuta_mgtorg2024,"一人一人が考えられる組織でないといけない
→超優秀な人が一人いてどうにかならなくなった？#mgtorg2024"
2024-10-08,11:38:25,noir@hoseinoir,"#mgtorg2024バイト先ではまず聞きなさいが原則だなあ
まあバイトだからなのかもだけどスタンドプレーするなって"
2024-10-08,11:38:32,ペパーミント@If8Rywjdt,"ディレイヤリング
バウンダリレス
ワークアウト
ストレッチ#mgtorg2024"
2024-10-08,11:38:54,まる@oDApfas7DPvsAp3,ストレッチ経験！！#mgtorg2024
2024-10-08,11:39:13,プリン@DFJCjy4gHbruyGo,上司に聞かないで自分で判断する「ディレイヤリング」難しそう。そんな環境や関係を作るのも難しいし、上司が部下の力を信じていないとなかなか達成しないよね#mgtorg2024
2024-10-08,11:39:44,味噌ラーメン@yuta_mgtorg2024,世の中に「合わせる」という意味での「ストレッチ」とも捉えられるかも？#mgtorg2024
2024-10-08,11:40:53,Metallica@dsmpG44yCS3083,#mgtorg2024能力が低くてもマニュアル通りにやっとけばよかった時代から個人も上司と同等のレベルを持ってないといけない時代になってる。そうしないと変化に適応できない。日本はそういった人材を育成できなかったのかな？
2024-10-08,11:41:30,うちだ@uchi_da0808,"#mgtorg2024マニュアルが通用しない環境になり、生産性重視の組織が落ち込む
↓
有機体としての組織が求められるように
↓
創造性の高い適応的熟達者・ナレッジワーカーの価値が高まる
↓
就活でガクチカ・主体性を重視する企業が多いのはこのため？"
2024-10-08,11:41:39,味噌ラーメン@yuta_mgtorg2024,"組織は変わらなきゃいけない、と思いつつも、何年も続けてきたことだから難しいのかも。
だからこそ、新卒の大学生に、「変えられる」能力を求められてるのかもなぁ…#mgtorg2024"
2024-10-08,11:42:19,ボウルサラダボウル@SiTiMiY4_ch,"#mgtorg2024でも権限委譲でも上司と「コミュニケーション］を取らなくなるわけではないんだよな。
むしろ、チームとしては創造性求めてるんだし"
2024-10-08,11:42:28,味噌ラーメン@yuta_mgtorg2024,"「フラット化」
→権限委譲が進み、上司にお伺いを立てる必要が少なくなった。#mgtorg2024"
2024-10-08,11:42:56,うちだ@uchi_da0808,#mgtorg2024フラットな組織・自立性重視の組織が魅力的と言われる風潮はこういう背景があるのか〜
2024-10-08,11:43:06,harunchu@hamunin331,フラット化か、なるほど#mgtorg2024
2024-10-08,11:43:12,ペパーミント@If8Rywjdt,変わろうとしてる企業は多いけど、企業の中に確立された古い価値観、昔からの強みを壊しながら進むのって本当に難しいはず。その意思決定はやはり官僚にあるんだよね…#mgtorg2024
2024-10-08,11:43:39,まめきち@mamekiti_hamham,フラット化の方、リーダーっていう存在は必要な気がするんだけど部下たちとは上下じゃなくて仲間って感じの横並びなイメージ#mgtorg2024
2024-10-08,11:44:13,味噌ラーメン@yuta_mgtorg2024,"プロジェクトチーム
→規模と時間のちょうどいい塩梅が保てるのかな？#mgtorg2024"
2024-10-08,11:44:20,Metallica@dsmpG44yCS3083,#mgtorg2024なんかそうなようなの別の授業でやったなぁ。タスクフォースみたいな。
2024-10-08,11:45:03,土方@ryunen_shimamu,コンサルとかこんな感じで各々がプロジェクトにアサインされるだけと聞いたなあ#mgtorg2024
2024-10-08,11:45:09,うちだ@uchi_da0808,"#mgtorg2024「プロジェクト」
ルーチン化されてない目的だけが設定された仕事を達成するために結成されるチーム。やり方や権限の面で自由なのが特徴"
2024-10-08,11:45:25,インドアなアウトドア派@indoornaoutdoor,組織のフラット化によって、役所に応じた給料ではなく、個人の能力に応じた給料になるのか？#mgtorg2024
2024-10-08,11:46:30,ボウルサラダボウル@SiTiMiY4_ch,"#mgtorg2024プロジェクトチームって昔から取り組まれてきた気がしるんだけど違うのか？

→今重要性が高まってるってだけ？"
2024-10-08,11:46:44,まる@oDApfas7DPvsAp3,"カフェゼミのチームも、カフェゼミが終われば解散
達成するため、プロジェクトを成功させるために、カフェゼミ前に研究室に集まって同じ時間を過ごす。そして、色んなことをやる。
これが楽しい#mgtorg2024"
2024-10-08,11:46:55,あもーれ@1sfzWkHIGu6XdGs,たとえプロジェクトが継続するとしても、メンバーが刷新されることもある。良くも悪くも組織文化とかは固着化しないから、動きやすいと思う。#mgtorg2024
2024-10-08,11:47:11,Metallica@dsmpG44yCS3083,#mgtorg2024プロジェクトチームってなんかドラクエみたいだな。魔王討伐が目的で多様な専門分野（戦士僧侶魔法使いみたいな）で構成されてて、少数でリーダー（勇者）はいるけど特に階級もないし。
2024-10-08,11:47:16,うちだ@uchi_da0808,#mgtorg2024もしかしてプロジェクトチームって割と最近主流になってきた形態ってことか？昔から普通にあると思ってた
2024-10-08,11:47:45,プリン@DFJCjy4gHbruyGo,"このピラミッド組織から権限委譲の話を聞いて地面師思い出した＾＾笑
本来は会議？を通して決定されるけど一人の人が全て早く進めてしまって詐欺に騙されてしまうっていう、、あれは社長も裏で同意してたとはいえ、彼の負う責任の大きさが大きすぎるよね、怖い#mgtorg2024"
